{
  "schema_version": 1,
  "navigation": [["Home","README.md"],["Featured","FEATURED.md"],["Projects","PROJECTS.md"],["Methods","METHODS.md"],["Research","RESEARCH.md"],["Outputs","OUTPUTS.md"],["Case Studies","CASE_STUDIES.md"],["Teaching","TEACHING.md"],["PyPI","PYPI.md"],["Statistics","STATISTICS.md"]],
  "projects": [
    {"repo":"feedback-intelligence-agent","title":"feedback-intelligence-agent","category":"Production AI","maturity":"production-style system","real_data":true,"research_software":false,"summary":"RAG with FastAPI, retrieval evaluation, observability and CI."},
    {"repo":"qwen-text2sql-lab","title":"qwen-text2sql-lab","category":"LLM adaptation","maturity":"empirical study","real_data":true,"research_software":false,"summary":"Controlled LoRA/QLoRA study evaluated by execution accuracy against the target database."},
    {"repo":"behavioral-sensing-research","title":"behavioral-sensing-research","category":"Statistical sensing","maturity":"research programme","real_data":false,"research_software":true,"summary":"Failure-aware multimodal sensing with explicit missing-evidence semantics and abstention."},
    {"repo":"genSurvPy","title":"genSurvPy","category":"Research software","maturity":"published software","real_data":false,"research_software":true,"summary":"Typed survival-data simulation with twelve model families and a general multistate engine.","pypi":"gen-surv","doi":true},
    {"repo":"setqca-python","title":"setqca","category":"Statistical methods","maturity":"published software","real_data":false,"research_software":true,"summary":"Native typed Python csQCA/fsQCA with exact Boolean minimisation.","pypi":"setqca","doi":true},
    {"repo":"clinic-forecasting-platform","title":"clinic-forecasting-platform","category":"Forecasting & MLOps","maturity":"production-style system","real_data":true,"research_software":false,"summary":"Healthcare demand forecasting with rolling-origin evaluation, conformal intervals, serving and monitoring."},
    {"repo":"transaction-risk-lakehouse","title":"transaction-risk-lakehouse","category":"Data engineering","maturity":"production-style system","real_data":true,"research_software":false,"summary":"PySpark lakehouse for transaction risk, fraud modelling and temporal validation."},
    {"repo":"oisst-fourier-neural-operator","title":"oisst-fourier-neural-operator","category":"Scientific ML","maturity":"empirical study","real_data":true,"research_software":false,"summary":"NOAA SST experiment testing when a Fourier Neural Operator beats persistence."},
    {"repo":"energy-system-simulator","title":"energy-system-simulator","category":"Optimisation","maturity":"decision system","real_data":false,"research_software":false,"summary":"Explicit unit commitment and storage optimisation under operational constraints."},
    {"repo":"portugal-public-pension-financing","title":"portugal-public-pension-financing","category":"Empirical research","maturity":"research programme","real_data":true,"research_software":false,"summary":"Auditable public-finance research separating legal obligations, accounting flows and actuarial liabilities."},
    {"repo":"short-rate-anomaly-regimes","title":"short-rate-anomaly-regimes","category":"Quantitative finance","maturity":"replication study","real_data":true,"research_software":false,"summary":"Replication-grade asset-pricing research with frozen artifacts and provenance checks."},
    {"repo":"bmssp","title":"bmssp","category":"Algorithms","maturity":"research software","real_data":false,"research_software":true,"summary":"Typed deterministic single-source shortest paths using a BMSSP-style divide-and-conquer design."},
    {"repo":"heavytails","title":"heavytails","category":"Statistical software","maturity":"published software","real_data":false,"research_software":true,"summary":"Heavy-tailed distributions, tail-index estimators, fitting and diagnostics.","pypi":"heavytails","doi":true},
    {"repo":"OversampleQA","title":"OversampleQA","category":"Statistical software","maturity":"published software","real_data":false,"research_software":true,"summary":"Oversampling validation and benchmarking toolkit for imbalanced classification.","pypi":"oversampleqa","doi":true},
    {"repo":"pinn","title":"PINNLab","category":"Scientific ML","maturity":"published software","real_data":false,"research_software":true,"summary":"Physics-Informed Neural Network toolkit for PDEs and inverse problems.","pypi":"pinnlab"},
    {"repo":"pinn-rk","title":"pinn-rk","category":"Scientific ML","maturity":"published software","real_data":false,"research_software":true,"summary":"Runge-Kutta Physics-Informed Neural Networks for time-discrete PDE learning.","pypi":"pinn-rk"},
    {"repo":"tscv-vision","title":"tscv-vision","category":"Time series","maturity":"published software","real_data":false,"research_software":true,"summary":"Computer-vision-inspired feature engineering for one-dimensional time series.","pypi":"tscv-vision"},
    {"repo":"wifi-csi-activity-recognition","title":"wifi-activity-recognition","category":"Sensing","maturity":"published software","real_data":true,"research_software":true,"summary":"CSI-based human-activity recognition with signal processing, training and streaming workflows.","pypi":"wifi-activity-recognition"},
    {"repo":"industrialstats","title":"industrialstats","category":"Statistical software","maturity":"published software","real_data":false,"research_software":true,"summary":"Design of experiments for Python: seedable design generators with analysis, diagnostics and power.","pypi":"industrialstats","doi":true},
    {"repo":"DataExcept","title":"DataExcept","category":"Data engineering","maturity":"published software","real_data":false,"research_software":false,"summary":"Hierarchical exception types for data, ML and pipeline failures, with error context and picklable errors.","pypi":"dataexcept"},
    {"repo":"anomalybench","title":"anomalybench","category":"Statistical software","maturity":"published software","real_data":false,"research_software":true,"summary":"Anomaly-detection algorithms, benchmark dataset loaders and a CLI comparing detectors under one protocol.","pypi":"anomalybench","doi":true},
    {"repo":"portugal-fiscal-balance","title":"portugal-fiscal-balance","category":"Public finance","maturity":"empirical study","real_data":true,"research_software":false,"summary":"General-government balance by subsector from 1977 onward with explicit accounting boundaries."},
    {"repo":"portugal-minimum-wage-inflation","title":"portugal-minimum-wage-inflation","category":"Labour economics","maturity":"empirical study","real_data":true,"research_software":false,"summary":"Minimum wages, productivity and consumer-price pass-through in Portugal."},
    {"repo":"portugal-public-debt-interest","title":"portugal-public-debt-interest","category":"Public finance","maturity":"empirical study","real_data":true,"research_software":false,"summary":"Measurement of Portugal's public-debt interest burden with reproducible official-statistics inputs."},
    {"repo":"portugal-external-growth-1960-1973","title":"portugal-external-growth-1960-1973","category":"Economic history","maturity":"research programme","real_data":true,"research_software":false,"summary":"Historical data pipeline comparing colonial and European economic linkages in Portuguese growth."},
    {"repo":"portugal-gdp-bayesian-revision","title":"portugal-gdp-bayesian-revision","category":"Official statistics","maturity":"empirical study","real_data":true,"research_software":false,"summary":"Audit of which official population denominator underlies Portugal's published GDP-per-capita index."},
    {"repo":"gdp-wage-transmission","title":"gdp-wage-transmission","category":"Labour economics","maturity":"research programme","real_data":true,"research_software":false,"summary":"Long-run and time-varying transmission from growth and productivity into real wages."},
    {"repo":"pt-salary-gamma-distribution","title":"pt-salary-gamma-distribution","category":"Distributional modelling","maturity":"empirical study","real_data":true,"research_software":false,"summary":"Distribution fitting for Portuguese grouped earnings data without assuming the Gamma family a priori."},
    {"repo":"europe-fsqca-innovation","title":"europe-fsqca-innovation","category":"Innovation research","maturity":"empirical study","real_data":true,"research_software":false,"summary":"Survey-design-aware fsQCA of configurational pathways to innovation across the EU-27."},
    {"repo":"scania-aps-cost","title":"scania-aps-cost","category":"Industrial ML","maturity":"decision study","real_data":true,"research_software":false,"summary":"Cost-sensitive failure prediction evaluated against explicit maintenance costs."},
    {"repo":"perishable-inventory-decision-lab","title":"perishable-inventory-decision-lab","category":"Decision science","maturity":"decision system","real_data":true,"research_software":false,"summary":"Probabilistic forecasting linked to replenishment-policy evaluation for perishable inventory."},
    {"repo":"csp_forecast_package","title":"csp_forecast_package","category":"Forecasting","maturity":"research software","real_data":false,"research_software":true,"summary":"Training-free probabilistic forecasting with Conformal Seasonal Pools."},
    {"repo":"rcpsp_cf_ivfth","title":"rcpsp_cf_ivfth","category":"Operations research","maturity":"decision system","real_data":false,"research_software":false,"summary":"Multi-mode project scheduling under financial constraints and fuzzy uncertainty."},
    {"repo":"ds-projects-portfolio","title":"ds-projects-portfolio","category":"Applied data science","maturity":"research portfolio","real_data":true,"research_software":false,"summary":"Portfolio of empirical decision and data-science projects, including mobility allocation and housing research."},